"scenario","logs_available_signal","trace_available_signal","likely_root_cause_from_logs","likely_root_cause_from_trace","diagnosis_confidence_logs","diagnosis_confidence_trace","dominant_span_type","dominant_span_duration_ms","dominant_span_share_pct","db_span_share_pct","downstream_span_share_pct","editorial_takeaway"
"baseline","status OK; duracion total baja; traceId/spanId para correlacion","pocos spans; una consulta DB compacta; sin error","request saludable; sin causa raiz que investigar","request saludable; DB acotada","high","high","business","10.11","63.87","55.5","0","El trace confirma la forma simple esperada; no todos los casos necesitan una narrativa compleja."
"optimized","status OK; duracion total baja; resultado de negocio correcto","pocos DB spans; agregacion visible","probablemente saludable; no prueba por si solo que no haya fan-out interno","consulta agregada sin fan-out DB relevante","medium","high","business","4.27","44.29","34.5","0","La comparacion con N+1 es fuerte porque el trace muestra menos spans para el mismo shape funcional."
"n-plus-one","status OK; duracion total elevada o ruidosa; traceId/spanId para buscar el caso","muchos DB spans dentro de una sola request; fan-out visible","ambiguo; requiere SQL logs, inspeccion extra o conocimiento previo del codigo","DB fan-out / N+1","low","high","business","137.43","92.56","86.24","0","Sin SQL debug, los logs sugieren lentitud; el trace muestra la forma repetitiva de la causa."
"downstream-slow","status OK; duracion total cercana al delay configurado","tiempo concentrado en spans HTTP/downstream","posible espera externa; DB y transformacion quedan poco separadas","downstream lento domina la request","medium","high","downstream","327.65","100","0","292.54","El trace separa espera externa de trabajo local sin convertir los logs en HTTP debug."
"mixed","status OK; duracion total alta; eventos de negocio por escenario","spans DB, downstream y transformacion ordenados temporalmente","ambiguo; varias etapas plausibles compiten como causa dominante","distribucion causal entre DB, downstream y transformacion","low","high","downstream","314.38","92.73","5.44","183.88","El caso mixto muestra mejor que los traces aportan estructura causal, no magia."
"partial-error","error controlado con status parcial; traceId/spanId; tipo de excepcion","spans marcados con error dentro de una request parcialmente exitosa","fallo downstream controlado; cuesta ver su posicion causal exacta","downstream fallo dentro de una request que responde parcialmente","medium","high","downstream","115.22","89.07","6.21","173.62","Logs y traces se complementan: el log avisa, el trace ubica el error en la jerarquia."
